{"actor":"p1","game":1,"kind":"information_observation","payload":{"card_names":[],"elapsed_seconds":295,"native":{"action":"Duel","log":{"private_log":"Viewed Opponent's Graveyard","public_log":"Viewed Opponent's Graveyard","type":"duel","username":"Aco77"},"play":"View GY 2","seconds":295,"username":"Aco77","viewing":"Opponent's Graveyard"},"play":"View GY 2","turn":4},"sequence":105,"source_index":104}
