{"actor":"p2","game":2,"kind":"turn","payload":{"card_names":[],"elapsed_seconds":1310,"native":{"action":"Duel","log":{"public_log":"Ended turn","type":"duel","username":"sdesowitz02"},"play":"End turn","seconds":1310,"username":"sdesowitz02"},"play":"End turn","turn":4},"sequence":463,"source_index":462}
