{"actor":"p1","game":1,"kind":"set","payload":{"card_names":[],"elapsed_seconds":834,"native":{"action":"Duel","id":690,"log":{"private_log":"Set \"Mirror Force\" from hand (1/3) to S-3","public_log":"Set card from hand (1/3) to S-3","type":"duel","username":"Aco77"},"play":"Set ST","seconds":834,"username":"Aco77"},"play":"Set ST","turn":8},"sequence":303,"source_index":302}
