{"actor":"p2","game":2,"kind":"shuffle","payload":{"card_names":[],"elapsed_seconds":975,"native":{"action":"Duel","hand":[724,725,726,727,728,729],"log":{"private_log":"Shuffled hand","public_log":"Shuffled hand","type":"duel","username":"sdesowitz02"},"play":"Shuffle hand","prev":[77,721,723,78,719,718],"seconds":975,"shuffle":true,"username":"sdesowitz02"},"play":"Shuffle hand","turn":2},"sequence":351,"source_index":350}
