{"actor":"p2","game":1,"kind":"information_observation","payload":{"card_names":[],"elapsed_seconds":842,"native":{"action":"Duel","log":{"private_log":"Viewed GY","public_log":"Viewed GY","type":"duel","username":"sdesowitz02"},"play":"View GY","seconds":842,"username":"sdesowitz02","viewing":"Graveyard"},"play":"View GY","turn":9},"sequence":310,"source_index":309}
