{"actor":"p1","game":1,"kind":"phase","payload":{"card_names":[],"elapsed_seconds":417,"native":{"action":"Duel","log":{"public_log":"Entered Main Phase 2","type":"duel","username":"Aco77"},"play":"Enter M2","seconds":417,"username":"Aco77"},"phase":"M2","play":"Enter M2","turn":6},"sequence":161,"source_index":160}
