{"actor":"p1","game":2,"kind":"communication","payload":{"card_names":[],"elapsed_seconds":1480,"native":{"action":"Duel","color":"0000FF","id":12,"log":{"id":12,"public_log":"\"lag\"","type":"chat","username":"Aco77"},"message":"lag","play":"Duel message","seconds":1480,"username":"Aco77"},"play":"Duel message","turn":8},"sequence":510,"source_index":509}
