{"actor":"p2","game":1,"kind":"information_observation","payload":{"card_names":[],"elapsed_seconds":179,"native":{"action":"Duel","log":{"public_log":"Stopped viewing GY","type":"duel","username":"sdesowitz02"},"play":"Stop viewing","seconds":179,"username":"sdesowitz02","viewing":"Graveyard"},"play":"Stop viewing","turn":3},"sequence":63,"source_index":62}
