{"actor":"p2","game":1,"kind":"activation_observation","payload":{"card_names":["Elemental HERO Stratos"],"elapsed_seconds":356,"native":{"action":"Duel","card":{"ability":"","arrows":"","atk":"1800","attribute":"WIND","card_type":"Monster","custom":0,"def":"300","effect":"When this card is Normal or Special Summoned: You can activate 1 of these effects;\n●Destroy Spells/Traps on the field, up to the number of \"HERO\" monsters you control, except this card.\n●Add 1 \"HERO\" monster from your Deck to your hand.","flip":0,"id":1408,"is_effect":1,"level":4,"monster_color":"Effect","name":"Elemental HERO Stratos","object_id":8,"ocg":1,"ocg_limit":3,"pendulum":0,"pendulum_effect":"","rush":0,"scale":0,"serial_number":"40044918","tcg":1,"tcg_limit":3,"treated_as":"Elemental HERO Stratos","type":"Warrior"},"id":574,"log":{"public_log":"Declared effect of \"Elemental HERO Stratos\" in M-3","type":"duel","username":"sdesowitz02"},"name":"Elemental HERO Stratos","play":"Declare","seconds":356,"username":"sdesowitz02"},"play":"Declare","turn":5},"sequence":131,"source_index":130}
