{"actor":"p1","game":2,"kind":"phase","payload":{"card_names":[],"elapsed_seconds":1117,"native":{"action":"Duel","log":{"public_log":"Entered Battle Phase","type":"duel","username":"Aco77"},"play":"Enter BP","seconds":1117,"username":"Aco77"},"phase":"BP","play":"Enter BP","turn":3},"sequence":391,"source_index":390}
