{"actor":"p1","game":1,"kind":"summon","payload":{"card_names":["Breaker the Magical Warrior"],"elapsed_seconds":407,"native":{"action":"Duel","card":{"ability":"","arrows":"","atk":"1600","attribute":"DARK","card_type":"Monster","custom":0,"def":"1000","effect":"If this card is Normal Summoned: Place 1 Spell Counter on it (max. 1). Gains 300 ATK for each Spell Counter on it. You can remove 1 Spell Counter from this card, then target 1 Spell/Trap on the field; destroy that target.","flip":0,"id":554,"is_effect":1,"level":4,"monster_color":"Effect","name":"Breaker the Magical Warrior","object_id":1,"ocg":1,"ocg_limit":3,"pendulum":0,"pendulum_effect":"","rush":0,"scale":0,"serial_number":"71413901","tcg":1,"tcg_limit":3,"treated_as":"Breaker the Magical Warrior","type":"Spellcaster"},"id":618,"log":{"public_log":"Normal Summoned \"Breaker the Magical Warrior\" from hand (1/4) to M-4","type":"duel","username":"Aco77"},"play":"Normal Summon","seconds":407,"username":"Aco77"},"play":"Normal Summon","turn":6},"sequence":155,"source_index":154}
