{"actor":"p2","game":2,"kind":"move","payload":{"card_names":["Return from the Different Dimension"],"elapsed_seconds":1556,"native":{"action":"Duel","card":{"ability":"","arrows":"","atk":"0","attribute":"","card_type":"Trap","custom":0,"def":"0","effect":"Pay half your LP; Special Summon as many of your banished monsters as possible. During the End Phase, banish all monsters that were Special Summoned by this effect.","flip":0,"id":3571,"is_effect":0,"level":0,"monster_color":"","name":"Return from the Different Dimension","object_id":66,"ocg":1,"ocg_limit":0,"pendulum":0,"pendulum_effect":"","points":10,"rush":0,"scale":0,"serial_number":"27174286","tcg":1,"tcg_limit":0,"treated_as":"Return from the Different Dimension","type":"Normal"},"id":770,"log":{"public_log":"Sent \"Return from the Different Dimension\" from S-3 to GY","type":"duel","username":"sdesowitz02"},"play":"To GY","seconds":1556,"username":"sdesowitz02"},"play":"To GY","turn":8},"sequence":537,"source_index":536}
