{"actor":"p2","game":2,"kind":"lp","payload":{"card_names":[],"elapsed_seconds":1205,"lp_after":5600,"lp_delta":-800,"native":{"action":"Duel","amount":-800,"life":5600,"log":{"public_log":"Lost 800 LP","type":"duel","username":"sdesowitz02"},"message":"sdesowitz02 has lost 800 life points","play":"Life points","points":800,"seconds":1205,"username":"sdesowitz02","word":"decreased"},"play":"Life points","turn":4},"sequence":409,"source_index":408}
