{"actor":"p2","game":2,"kind":"phase","payload":{"card_names":[],"elapsed_seconds":1396,"native":{"action":"Duel","log":{"public_log":"Entered Main Phase 1","type":"duel","username":"sdesowitz02"},"play":"Enter M1","seconds":1396,"username":"sdesowitz02"},"phase":"M1","play":"Enter M1","turn":8},"sequence":500,"source_index":499}
