{"actor":"p1","game":2,"kind":"turn","payload":{"card_names":[],"elapsed_seconds":1383,"native":{"action":"Duel","log":{"public_log":"Entered Draw Phase","type":"duel","username":"Aco77"},"play":"Start turn","seconds":1383,"username":"Aco77"},"play":"Start turn","turn":7},"sequence":492,"source_index":491}
