{"actor":"p2","game":2,"kind":"move","payload":{"card_names":["E - Emergency Call"],"elapsed_seconds":995,"native":{"action":"Duel","card":{"ability":"","arrows":"","atk":"0","attribute":"","card_type":"Spell","custom":0,"def":"0","effect":"Add 1 \"Elemental HERO\" monster from your Deck to your hand.","flip":0,"id":1314,"is_effect":0,"level":0,"monster_color":"","name":"E - Emergency Call","object_id":19,"ocg":1,"ocg_limit":3,"pendulum":0,"pendulum_effect":"","rush":0,"scale":0,"serial_number":"0213326","tcg":1,"tcg_limit":3,"treated_as":"E - Emergency Call","type":"Normal"},"id":727,"log":{"public_log":"Sent \"E - Emergency Call\" from S-3 to GY","type":"duel","username":"sdesowitz02"},"play":"To GY","seconds":995,"username":"sdesowitz02"},"play":"To GY","turn":2},"sequence":359,"source_index":358}
