{"actor":"p2","game":2,"kind":"set","payload":{"card_names":[],"elapsed_seconds":1037,"native":{"action":"Duel","id":771,"log":{"private_log":"Set \"Mystical Space Typhoon\" from hand (4/5) to S-4","public_log":"Set card from hand (4/5) to S-4","type":"duel","username":"sdesowitz02"},"play":"Set ST","seconds":1037,"username":"sdesowitz02"},"play":"Set ST","turn":2},"sequence":369,"source_index":368}
