{"actor":"p2","game":1,"kind":"phase","payload":{"card_names":[],"elapsed_seconds":784,"native":{"action":"Duel","log":{"public_log":"Entered End Phase","type":"duel","username":"sdesowitz02"},"play":"Enter EP","seconds":784,"username":"sdesowitz02"},"phase":"EP","play":"Enter EP","turn":7},"sequence":290,"source_index":289}
