{"actor":"p2","game":1,"kind":"field_observation","payload":{"card_names":[],"elapsed_seconds":727,"native":{"action":"Duel","id":623,"log":{"public_log":"Removed \"Token\" from M-4","type":"duel","username":"sdesowitz02"},"play":"Remove Token","seconds":727,"username":"sdesowitz02"},"play":"Remove Token","turn":7},"sequence":268,"source_index":267}
