{"actor":null,"game":1,"kind":"communication","payload":{"card_names":[],"elapsed_seconds":649,"native":{"action":"Duel","log":{"public_log":"The game can resume","type":"game","username":"Duelingbook"},"play":"Resume game","seconds":649,"username":"Duelingbook"},"play":"Resume game","turn":7},"sequence":243,"source_index":242}
