{"actor":"p2","game":1,"kind":"move","payload":{"card_names":["Trade-In"],"elapsed_seconds":60,"native":{"action":"Duel","card":{"ability":"","arrows":"","atk":"0","attribute":"","card_type":"Spell","custom":0,"def":"0","effect":"Discard 1 Level 8 monster; draw 2 cards.","flip":0,"id":4436,"is_effect":0,"level":0,"monster_color":"","name":"Trade-In","object_id":39,"ocg":1,"ocg_limit":3,"pendulum":0,"pendulum_effect":"","points":5,"rush":0,"scale":0,"serial_number":"38120068","tcg":1,"tcg_limit":3,"treated_as":"Trade-In","type":"Normal"},"id":77,"log":{"public_log":"Milled \"Trade-In\" from top of deck","type":"duel","username":"sdesowitz02"},"play":"Mill","seconds":60,"username":"sdesowitz02"},"play":"Mill","turn":1},"sequence":15,"source_index":14}
