{"actor":"p2","game":2,"kind":"result_observation","payload":{"card_names":[],"elapsed_seconds":1183,"native":{"action":"Duel","log":{"public_log":"Lost connection","type":"duel","username":"sdesowitz02"},"play":"Left duel","seconds":1183,"username":"sdesowitz02"},"play":"Left duel","turn":4},"sequence":402,"source_index":401}
