{"actor":"p2","game":1,"kind":"shuffle","payload":{"card_names":[],"elapsed_seconds":150,"native":{"action":"Duel","deck":[525,526,527,528,529,530,531,532,533,534,535,536,537,538,539,540,541,542,543,544,545,546,547,548,549,550,551,552,553],"log":{"private_log":"Shuffled deck","public_log":"Shuffled deck","type":"duel","username":"sdesowitz02"},"message":"sdesowitz02 shuffled his deck","play":"Shuffle deck","seconds":150,"shuffle":true,"username":"sdesowitz02"},"play":"Shuffle deck","turn":3},"sequence":46,"source_index":45}
