{"actor":"p2","game":1,"kind":"information_observation","payload":{"card_names":[],"elapsed_seconds":690,"native":{"action":"Duel","log":{"private_log":"Viewed Banished","public_log":"Viewed Banished","type":"duel","username":"sdesowitz02"},"play":"View Banished","seconds":690,"username":"sdesowitz02","viewing":"Banished"},"play":"View Banished","turn":7},"sequence":258,"source_index":257}
